{
  "schema_version": 1,
  "generated_by": "python -m scripts.verify",
  "environment": "offline_dev",
  "code_commit": "30f62c6805a598d47455e73e6578521b29377e7a",
  "checked_at": "2026-10-22T12:54:06.577192+00:00",
  "integrations": {
    "crawl4ai": {
      "state": "ADAPTER_READY",
      "live_test": false,
      "evidence": [
        "docs/evidence/security.json",
        "docs/evidence/contracts.json",
        "docs/evidence/browser.json"
      ],
      "blocked_reason": "Local real Crawl4AI/Chromium/private storage and RLS tests, MOCK website resources/model responses, saved AI prefill/visual-guidance browser fixtures and multimodal SDK image/citation/budget contracts. Real public rendered HTTP smoke is separately scoped. Deployed broker, actual visual-model quality, paid model evidence and full end-to-end product remain incomplete."
    },
    "docling": {
      "state": "ADAPTER_READY",
      "live_test": false,
      "evidence": [
        "docs/evidence/security.json"
      ],
      "blocked_reason": "Real local Docling/native rendering/English textless-page OCR, private page storage, Temporal/RLS, approved document visual provenance and account quota tests. The model sees actual page pixels through the official adapter with explicitly MOCK responses. Mixed-content OCR, broader document fidelity, full business roles, deployed sandbox and live model quality/provider journeys remain incomplete."
    },
    "deepagents": {
      "state": "ADAPTER_READY",
      "live_test": false,
      "evidence": [
        "docs/evidence/security.json",
        "docs/evidence/contracts.json",
        "docs/evidence/browser.json"
      ],
      "blocked_reason": "Actual isolated Deep Agents with pinned owner skills, read-only brand context, real local Temporal/S3/RLS, Fabric text edits/PNG export and immutable approval tested. OpenAI planning/image create/edit transports are MOCK. No paid image quality proof, deployed sandbox, publishing, visual reference approval, video/carousel, complete credit reconciliation or production launch evidence."
    },
    "openai_images": {
      "state": "ADAPTER_READY",
      "live_test": false,
      "evidence": [
        "docs/evidence/security.json",
        "docs/evidence/contracts.json",
        "docs/evidence/browser.json"
      ],
      "blocked_reason": "Actual isolated Deep Agents with pinned owner skills, read-only brand context, real local Temporal/S3/RLS, Fabric text edits/PNG export and immutable approval tested. OpenAI planning/image create/edit transports are MOCK. No paid image quality proof, deployed sandbox, publishing, visual reference approval, video/carousel, complete credit reconciliation or production launch evidence."
    },
    "higgsfield_video": {
      "state": "NOT_IMPLEMENTED",
      "live_test": false,
      "evidence": [
        "docs/evidence/document-visuals.json",
        "docs/evidence/video-storage.json",
        "docs/evidence/video-runtime.json",
        "docs/evidence/video-provider.json",
        "docs/evidence/deployment.json",
        "docs/evidence/publishing-ui.json",
        "docs/evidence/publishing.json",
        "docs/evidence/connections.json",
        "docs/evidence/social.json",
        "docs/evidence/offline.json",
        "docs/evidence/browser.json",
        "docs/evidence/contracts.json",
        "docs/evidence/security.json"
      ],
      "blocked_reason": "Transport, untrusted download and durable provider substage have separate local test scope. Connecting the separately tested skill/media components into the full tenant generation/edit workflow, approved reference leases, baked media image and overlay composition, private versions/approval, customer UI and cost-capped live acceptance remain incomplete. No video customer route is enabled."
    },
    "creative_editor": {
      "state": "ADAPTER_READY",
      "live_test": false,
      "evidence": [
        "docs/evidence/security.json",
        "docs/evidence/contracts.json",
        "docs/evidence/browser.json"
      ],
      "blocked_reason": "Actual isolated Deep Agents with pinned owner skills, read-only brand context, real local Temporal/S3/RLS, Fabric text edits/PNG export and immutable approval tested. OpenAI planning/image create/edit transports are MOCK. No paid image quality proof, deployed sandbox, publishing, visual reference approval, video/carousel, complete credit reconciliation or production launch evidence."
    },
    "postiz_publish": {
      "state": "NOT_IMPLEMENTED",
      "live_test": false,
      "evidence": [
        "docs/evidence/social.json",
        "docs/evidence/publishing.json"
      ],
      "blocked_reason": "Actual local session/RLS, exact approved Fabric-rendered PNG/private S3, dispatcher and Temporal publication/reconciliation use an explicitly MOCK Postiz HTTP server. Explicit destination consent, expiring staging allowlists, immutable snapshots/history and unknown-write holds tested. No actual social publication, deployed/runtime equivalence or launch proof. Customer publishing UI has separate focused evidence. Remote cancellation/rescheduling, operator recovery, other channels/formats, analytics and live acceptance remain incomplete."
    },
    "performance_learning": {
      "state": "NOT_IMPLEMENTED",
      "live_test": false,
      "evidence": [
        "docs/evidence/document-visuals.json",
        "docs/evidence/video-storage.json",
        "docs/evidence/video-runtime.json",
        "docs/evidence/video-provider.json",
        "docs/evidence/deployment.json",
        "docs/evidence/publishing-ui.json",
        "docs/evidence/publishing.json",
        "docs/evidence/connections.json",
        "docs/evidence/social.json",
        "docs/evidence/offline.json",
        "docs/evidence/browser.json",
        "docs/evidence/contracts.json",
        "docs/evidence/security.json"
      ],
      "blocked_reason": "Product provider journey and authorized staging verification are not implemented; M0 audit evidence does not prove a working integration."
    },
    "tenant_runtime": {
      "state": "NOT_IMPLEMENTED",
      "live_test": false,
      "evidence": [
        "docs/evidence/document-visuals.json",
        "docs/evidence/video-storage.json",
        "docs/evidence/video-runtime.json",
        "docs/evidence/video-provider.json",
        "docs/evidence/deployment.json",
        "docs/evidence/publishing-ui.json",
        "docs/evidence/publishing.json",
        "docs/evidence/connections.json",
        "docs/evidence/social.json",
        "docs/evidence/offline.json",
        "docs/evidence/browser.json",
        "docs/evidence/contracts.json",
        "docs/evidence/security.json"
      ],
      "blocked_reason": "Auth/workspace/brand/team APIs and RLS are implemented locally; deployed private storage, generation-worker authorization and deployed tenant journey remain incomplete."
    },
    "workspace_auth": {
      "state": "ADAPTER_READY",
      "live_test": false,
      "evidence": [
        "docs/evidence/security.json"
      ],
      "blocked_reason": "Local HTTP/PostgreSQL/SMTP foundation tests only. External deployment, actual sender/delivery validation, invitation UX and broader tenant runtime remain incomplete."
    },
    "account_email": {
      "state": "ADAPTER_READY",
      "live_test": false,
      "evidence": [
        "docs/evidence/security.json"
      ],
      "blocked_reason": "Encrypted queue, verification/reset/invitations and SMTP error paths tested against a local server only. Real sender credentials, deliverability, UI and operator retry/monitoring remain unverified/incomplete."
    },
    "private_assets": {
      "state": "ADAPTER_READY",
      "live_test": false,
      "evidence": [
        "docs/evidence/security.json"
      ],
      "blocked_reason": "Actual local Garage/ClamAV/Temporal tests only. Production IAM/CORS/TLS, retention, cleanup, UI, intake sandbox and deployed/provider workflows remain incomplete."
    },
    "durable_asset_jobs": {
      "state": "ADAPTER_READY",
      "live_test": false,
      "evidence": [
        "docs/evidence/security.json"
      ],
      "blocked_reason": "Actual local Garage/ClamAV/Temporal tests only. Production IAM/CORS/TLS, retention, cleanup, UI, intake sandbox and deployed/provider workflows remain incomplete."
    },
    "customer_workspace_ui": {
      "state": "ADAPTER_READY",
      "live_test": false,
      "evidence": [
        "docs/evidence/browser.json",
        "docs/evidence/security.json"
      ],
      "blocked_reason": "Real local browser account/client/brand/team/upload flows only. Deployed ingress/CORS, email delivery, generation, editor and publishing UI remain incomplete."
    },
    "brand_evidence": {
      "state": "ADAPTER_READY",
      "live_test": false,
      "evidence": [
        "docs/evidence/security.json"
      ],
      "blocked_reason": "Real local Docling/native rendering/English textless-page OCR, private page storage, Temporal/RLS, approved document visual provenance and account quota tests. The model sees actual page pixels through the official adapter with explicitly MOCK responses. Mixed-content OCR, broader document fidelity, full business roles, deployed sandbox and live model quality/provider journeys remain incomplete."
    },
    "business_accounts": {
      "state": "ADAPTER_READY",
      "live_test": false,
      "evidence": [
        "docs/evidence/security.json"
      ],
      "blocked_reason": "Real local Docling/native rendering/English textless-page OCR, private page storage, Temporal/RLS, approved document visual provenance and account quota tests. The model sees actual page pixels through the official adapter with explicitly MOCK responses. Mixed-content OCR, broader document fidelity, full business roles, deployed sandbox and live model quality/provider journeys remain incomplete."
    },
    "v5_business_ui": {
      "state": "ADAPTER_READY",
      "live_test": false,
      "evidence": [